<?xml version = "1.0" encoding = "UTF-8" ?>
<parser 
	xmlns="http://www.ondex.org/xml/schema/tab_parser" 
	xmlns:xsi="http://www.w3.org/2001/XMLSchema-instance" xsi:schemaLocation="http://www.ondex.org/xml/schema/tab_parser ../../../../main/resources/tab_parser.xsd ">

	<delimiter>\t</delimiter>
	<start-line>1</start-line>
		
	<concept id = "c1">
		<class>Gene</class>
		<accession data-source = "ENSEMBL">
			<column index = '0' />
		</accession>
		<name><column index = '0' /></name>
		<parser-id><column index = '0' /></parser-id>		
		<data-source>ENSEMBL</data-source>
		<attribute name="TAXID" type = "TEXT" indexed = 'false'>9606</attribute>
		<attribute name="Note" type = "TEXT">
			<column index = '3' />
		</attribute>
	</concept>
	
	<concept id = "c2">
		<class>Gene</class>
		<accession data-source = "ENSEMBL">
			<column index = '1' />
		</accession>
		<name><column index = '1' /></name>
		<parser-id><column index = '1' /></parser-id>		
		<data-source>ENSEMBL</data-source>
		<attribute name="TAXID" type = "TEXT" indexed = 'false'>9606</attribute>
		<attribute name="Note" type = "TEXT">
			<column index = '4' />
		</attribute>
	</concept>


	<relation source-ref = 'c1' target-ref = 'c2'>
		<type><column index = '2' /></type>
		<attribute name="TestRelationAttribute" type = "TEXT">
			<column index = '5' />
		</attribute>		
	</relation>

</parser>
