<?xml version = "1.0" encoding = "UTF-8" ?>
<parser 
	xmlns="http://www.ondex.org/xml/schema/tab_parser" 
	xmlns:xsi="http://www.w3.org/2001/XMLSchema-instance" xsi:schemaLocation="http://www.ondex.org/xml/schema/tab_parser ../../../../main/resources/tab_parser.xsd ">

	<delimiter>\t</delimiter>
	<start-line>1</start-line>
		
	<concept id = "c1">
		<class><column index = '1' /></class>
		<accession data-source = "FooSource">
			<column index = '0' />
		</accession>
		<name><column index = '0' /></name>
		<parser-id><column index = '0' /></parser-id>		
		<data-source>FooSource</data-source>
		<attribute name="TAXID" type = "TEXT" indexed = 'false'>9606</attribute>
		<attribute name="Notes" type = "TEXT">
			<column index = '2' />
		</attribute>
	</concept>
	
</parser>
